<?xml version="1.0" encoding="UTF-8"?>
<schema xmlns="http://www.w3.org/2001/XMLSchema">
  <element name="alumnos"> 
    <complexType>
      <sequence>
        <element name="alumno" maxOccurs="unbounded"> <complexType>
            <sequence>
              <element name="nombre" type="string" />
              <element name="nacimiento" type="date" />
            </sequence>
          </complexType>
        </element>
      </sequence>
    </complexType>
  </element>
</schema>